{
  "schemaVersion": "1.0.0",
  "requestId": "REQ-002",
  "status": "draft",
  "depth": "L2",
  "goal": "Choose the settlement flow that a requested API change should affect.",
  "observableOutcome": "The selected flow and its user-observable verification are explicit before implementation.",
  "scope": {
    "included": [
      "Settlement API behavior"
    ],
    "excluded": [
      "Implementation before approval"
    ]
  },
  "acceptanceCriteria": [
    {
      "id": "AC-101",
      "statement": "The selected settlement flow returns the agreed API response."
    }
  ],
  "constraints": [
    "Preserve unrelated uncommitted changes."
  ],
  "verificationScenarios": [
    {
      "id": "VS-101",
      "acceptanceCriteriaRefs": [
        "AC-101"
      ],
      "actor": "developer",
      "surface": "api",
      "preconditions": [
        "The user identifies the settlement flow in scope."
      ],
      "steps": [
        "Call the selected API with an agreed representative request."
      ],
      "expected": [
        "The response matches the approved behavior."
      ],
      "evidence": [
        "Retain the request, response, and automated-test output."
      ]
    }
  ],
  "authority": {
    "decisionMaker": "user",
    "boundaries": [
      "The user must choose which settlement flow is in scope."
    ]
  },
  "facts": [
    {
      "id": "FACT-101",
      "statement": "The repository contains multiple candidate settlement flows."
    }
  ],
  "inferences": [
    {
      "id": "INF-101",
      "statement": "Changing the wrong flow could leave the intended behavior unchanged."
    }
  ],
  "assumptions": [],
  "decisions": [],
  "materialOpenItems": [
    {
      "id": "OPEN-101",
      "statement": "Which settlement flow is the requested target?"
    }
  ],
  "stalledRounds": 0,
  "approval": null,
  "alternatives": [
    {
      "id": "ALT-101",
      "option": "Change the existing synchronous settlement flow.",
      "reason": "It is one plausible interpretation pending user confirmation."
    },
    {
      "id": "ALT-102",
      "option": "Change the asynchronous settlement flow.",
      "reason": "It is another plausible interpretation pending user confirmation."
    }
  ],
  "affectedPaths": [
    "Settlement API clients",
    "Settlement processing flow"
  ],
  "sideEffects": [
    "Selecting one flow may leave another flow unchanged."
  ],
  "reversibility": {
    "level": "moderate",
    "cost": "Rework the implementation and rerun integration verification."
  }
}
