{
  "schemaVersion": "1.0.0",
  "requestId": "REQ-001",
  "status": "approved",
  "depth": "L1",
  "goal": "Validate a request frame deterministically.",
  "observableOutcome": "The validator returns a stable result for the same frame.",
  "scope": {
    "included": [
      "Request Frame validation"
    ],
    "excluded": [
      "Executing the approved request"
    ]
  },
  "acceptanceCriteria": [
    {
      "id": "AC-001",
      "statement": "A valid approved L1 frame exits successfully."
    }
  ],
  "constraints": [
    "Use only the Node.js standard library."
  ],
  "verificationScenarios": [
    {
      "id": "VS-001",
      "acceptanceCriteriaRefs": [
        "AC-001"
      ],
      "actor": "automated-test",
      "surface": "cli",
      "preconditions": [
        "The frame is stored as UTF-8 JSON."
      ],
      "steps": [
        "Run validate-frame.mjs with the frame path."
      ],
      "expected": [
        "The process exits with status 0."
      ],
      "evidence": [
        "The JSON result contains valid=true."
      ]
    }
  ],
  "authority": {
    "decisionMaker": "user",
    "boundaries": [
      "Approval authorizes only the work described by this frame."
    ]
  },
  "facts": [
    {
      "id": "FACT-001",
      "statement": "The validator runs on Node.js 23."
    }
  ],
  "inferences": [],
  "assumptions": [],
  "decisions": [
    {
      "id": "DEC-001",
      "statement": "Use a CLI verification surface.",
      "materiality": "minor",
      "effect": "default",
      "revisability": "easy"
    }
  ],
  "materialOpenItems": [],
  "stalledRounds": 0,
  "approval": {
    "approvedBy": "user",
    "approvedAt": "2026-09-21T00:00:00.000Z",
    "frameDigest": "696219a3e4ddbb5992e36ac838a9be42a069574c0eeb5744b2a5f17c51bef3e9"
  }
}
